{
  "format": "haiyue-composition",
  "version": 1,
  "parts": [
    {
      "id": "data",
      "extension": "org.haiyue.data-binding@1",
      "required": true,
      "requires": [],
      "dependencies": [
        "state",
        "layout"
      ],
      "document": {
        "format": "haiyue-data-binding",
        "version": 1,
        "extension": "org.haiyue.data-binding@1",
        "enums": [],
        "models": [
          {
            "id": "Root",
            "properties": [
              {
                "id": "go",
                "kind": "boolean",
                "defaultValue": false
              },
              {
                "id": "label",
                "kind": "string",
                "defaultValue": "你好 A"
              }
            ]
          }
        ],
        "instances": [
          {
            "id": "root",
            "model": "Root",
            "scope": "local",
            "values": {
              "go": false,
              "label": "你好 A"
            }
          }
        ],
        "converters": [],
        "propertyGroups": [],
        "components": [],
        "bindings": [
          {
            "id": "value",
            "target": "text",
            "targetPath": [
              "strings",
              "value"
            ],
            "source": {
              "mode": "explicit",
              "instance": "root",
              "path": [
                "label"
              ]
            },
            "direction": "read"
          },
          {
            "id": "write-label",
            "target": "text",
            "targetPath": [
              "strings",
              "value"
            ],
            "source": {
              "mode": "explicit",
              "instance": "root",
              "path": [
                "label"
              ]
            },
            "direction": "write"
          },
          {
            "id": "go",
            "target": "go",
            "targetPath": [
              "value"
            ],
            "source": {
              "mode": "explicit",
              "instance": "root",
              "path": [
                "go"
              ]
            },
            "direction": "read"
          },
          {
            "id": "write-go",
            "target": "go",
            "targetPath": [
              "value"
            ],
            "source": {
              "mode": "explicit",
              "instance": "root",
              "path": [
                "go"
              ]
            },
            "direction": "write"
          }
        ]
      }
    },
    {
      "id": "state",
      "extension": "org.haiyue.animation-state-machine@2",
      "required": true,
      "requires": [],
      "dependencies": [
        "core"
      ],
      "document": {
        "format": "haiyue-animation-state-machine@2",
        "extension": "org.haiyue.animation-state-machine@2",
        "channels": [
          {
            "id": "style",
            "target": "node",
            "path": "components.0.paint.fill.color",
            "family": "paint-path",
            "valueKind": "color",
            "valueSize": 4,
            "policy": "override",
            "defaultValue": [
              1,
              0,
              0,
              1
            ]
          }
        ],
        "components": [],
        "clips": [
          {
            "id": "0",
            "duration": 1,
            "tracks": [
              {
                "id": "style",
                "channel": "style",
                "keys": [
                  {
                    "time": 0,
                    "value": [
                      1,
                      0,
                      0,
                      1
                    ],
                    "interpolation": {
                      "kind": "hold"
                    }
                  },
                  {
                    "time": 1,
                    "value": [
                      1,
                      0,
                      0,
                      1
                    ]
                  }
                ]
              }
            ]
          },
          {
            "id": "1",
            "duration": 1,
            "tracks": [
              {
                "id": "style",
                "channel": "style",
                "keys": [
                  {
                    "time": 0,
                    "value": [
                      0,
                      0,
                      1,
                      1
                    ],
                    "interpolation": {
                      "kind": "hold"
                    }
                  },
                  {
                    "time": 1,
                    "value": [
                      0,
                      0,
                      1,
                      1
                    ]
                  }
                ]
              }
            ]
          }
        ],
        "stateMachines": [
          {
            "id": "main",
            "inputs": [
              {
                "id": "go",
                "type": "boolean",
                "defaultValue": false
              }
            ],
            "layers": [
              {
                "id": "base",
                "order": 0,
                "states": [
                  {
                    "id": "0",
                    "motion": {
                      "kind": "clip",
                      "clip": "0",
                      "playback": "one-shot"
                    }
                  },
                  {
                    "id": "1",
                    "motion": {
                      "kind": "clip",
                      "clip": "1",
                      "playback": "one-shot"
                    }
                  }
                ],
                "transitions": [
                  {
                    "id": "entry",
                    "from": "@entry",
                    "to": "0",
                    "duration": 0,
                    "conditionGroups": []
                  },
                  {
                    "id": "go",
                    "from": "0",
                    "to": "1",
                    "duration": 1,
                    "conditionGroups": [
                      [
                        {
                          "kind": "input",
                          "input": "go",
                          "comparator": "equal",
                          "value": true
                        }
                      ]
                    ]
                  }
                ]
              }
            ]
          }
        ]
      }
    },
    {
      "id": "core",
      "extension": "org.haiyue.animation-core@1",
      "required": true,
      "requires": [],
      "dependencies": [],
      "document": {
        "format": "haiyue-animation",
        "version": "1.0",
        "canvas": {
          "width": 320,
          "height": 480,
          "coordinateSystem": "screen-y-down"
        },
        "duration": 2,
        "resources": [
          {
            "id": "core-image",
            "type": "image",
            "uri": "asset:alternate",
            "width": 3,
            "height": 3,
            "mimeType": "image/png",
            "integrity": "sha256-cCVFSxm7uq7YWSdzGwgEbovd5iM6pED8GVhg+iGnbq8=",
            "colorSpace": "linear"
          }
        ],
        "extensionsUsed": [],
        "nodes": [
          {
            "id": "node",
            "transform": {
              "position": [
                230,
                55
              ]
            },
            "components": [
              {
                "type": "shape2d",
                "shape": "rect",
                "size": [
                  80,
                  42
                ],
                "fill": [
                  1,
                  0,
                  0,
                  1
                ]
              }
            ]
          },
          {
            "id": "sprite",
            "transform": {
              "position": [
                230,
                125
              ]
            },
            "components": [
              {
                "type": "sprite2d",
                "resource": "core-image",
                "size": [
                  48,
                  40
                ]
              }
            ]
          }
        ],
        "tracks": []
      }
    },
    {
      "id": "layout",
      "extension": "org.haiyue.layout-2d@1",
      "required": true,
      "requires": [],
      "dependencies": [],
      "document": {
        "format": "haiyue-responsive-layout-2d",
        "version": 1,
        "extension": "org.haiyue.layout-2d@1",
        "shaping": {
          "stack": "haiyue-text-shaping@1",
          "backendRevision": "g11-owned-font-1",
          "unicodeVersion": "15.1",
          "graphemeRevision": "uax29-43",
          "bidiRevision": "uax9-50"
        },
        "assets": [
          {
            "id": "font",
            "kind": "font",
            "family": "Haiyue G11 Scene Sans",
            "weight": 400,
            "style": "normal",
            "source": {
              "kind": "referenced",
              "uri": "asset:font",
              "integrity": "sha256-9ipJd+MNkryPnaPv8nB3VtPXa8AL4OVJ52xDyj76QE8="
            },
            "metrics": {
              "unitsPerEm": 1000,
              "ascent": 1160,
              "descent": -288,
              "lineGap": 0,
              "missingGlyph": {
                "glyphId": 0,
                "advance": 1000,
                "bounds": [
                  100,
                  -120,
                  900,
                  880
                ]
              },
              "glyphs": {
                "0": {
                  "glyphId": 17,
                  "advance": 555,
                  "bounds": [
                    50,
                    -13,